<!-- Example XML Schema Definition (XSD) -->
<xs:schema xmlns:xs="http://www.w3.org/2001/XMLSchema">
    <xs:element name="BookStore">
        <xs:complexType>
            <xs:sequence>
                <xs:element name="Book" maxOccurs="unbounded">
                    <xs:complexType>
                        <xs:sequence>
                            <xs:element name="Title" type="xs:string"/>
                            <xs:element name="Author" type="xs:string"/>
                            <xs:element name="Price" type="xs:decimal"/>
                        </xs:sequence>
                        <xs:attribute name="ISBN" type="xs:string" use="required"/>
                    </xs:complexType>
                </xs:element>
            </xs:sequence>
        </xs:complexType>
    </xs:element>
</xs:schema>
